{
  "id": "natural-profile-lady-gaga",
  "personId": "person-lady-gaga",
  "hairTypeId": {
    "value": null,
    "provenance": {
      "source": "not-documented",
      "status": "unverified",
      "confidence": "low",
      "note": "Public photos show wigs, color-treated hair and styled looks; natural texture is not established."
    }
  },
  "hairSubtypeId": {
    "value": null,
    "provenance": {
      "source": "not-documented",
      "status": "unverified",
      "confidence": "low",
      "note": "No reliable public source establishes a natural hair subtype."
    }
  },
  "naturalHairColor": {
    "value": null,
    "provenance": {
      "source": "not-documented",
      "status": "unverified",
      "confidence": "low",
      "note": "Public photographs show changing hair colors and wigs; natural hair color is not established."
    }
  },
  "naturalSkinTone": {
    "value": null,
    "provenance": {
      "source": "not-documented",
      "status": "unverified",
      "confidence": "low",
      "note": "Not assessed for this hairstyle-focused profile."
    }
  },
  "hairThickness": {
    "value": null,
    "provenance": {
      "source": "not-documented",
      "status": "unverified",
      "confidence": "low",
      "note": "Individual strand thickness cannot be established from the available styled photographs."
    }
  },
  "hairDensity": {
    "value": null,
    "provenance": {
      "source": "not-documented",
      "status": "unverified",
      "confidence": "low",
      "note": "Styled photographs and wigs cannot establish natural hair density."
    }
  }
}
